{
  "$schema": "https://json-schema.org/draft/2020-12/schema",
  "$id": "tenra-registry.ledger-export.v1",
  "title": "Registry Ledger export",
  "type": "object",
  "additionalProperties": true,
  "required": [
    "schema",
    "exportId",
    "exportedAt",
    "organizationId",
    "sourceApp",
    "rows"
  ],
  "properties": {
    "schema": {
      "const": "tenra-registry.ledger-export.v1",
      "type": "string"
    },
    "exportId": {
      "type": "string"
    },
    "exportedAt": {
      "type": "string"
    },
    "organizationId": {
      "type": "string"
    },
    "sourceApp": {
      "type": "string"
    },
    "rows": {
      "type": "array"
    }
  },
  "x-tenra": {
    "ownerApp": "registry",
    "producerApp": "registry",
    "consumerApps": [
      "ledger"
    ],
    "fixture": "tenra Registry/fixtures/handoffs/ledger-export.json",
    "correlationFields": [
      "exportId"
    ],
    "standardControls": [
      "schema badge",
      "download JSON",
      "replay",
      "history",
      "correlation id"
    ]
  }
}
