{
  "schema": "tenra-registry.ledger-export.v1",
  "exportId": "registry-ledger-demo-recv-001",
  "exportedAt": "2026-05-06T17:30:00.000Z",
  "organizationId": "org_demo_storage",
  "sourceApp": "registry",
  "rows": [
    {
      "externalId": "recv_001",
      "customerCode": "cust_001",
      "customerName": "Acme Builders",
      "rentalCode": "assign_001",
      "unitCode": "UNIT-014",
      "entryType": "charge",
      "effectiveDate": "2026-05-01",
      "description": "May container rental",
      "amountMinor": 24000,
      "reference": "RR-2026-05",
      "notes": "Golden fixture for Ledger import preview."
    }
  ]
}
